key,job_role,job_title,company_name,skills,job_type,location,experience
1,data engineer,"sr. data engineer, global analytic (tcf)",concentrix,"data analysis,advance excel,pivot tables",full time,pune,5
2,data engineer,data engineer,praxis placement consultancy,"snowflakes,data integrations",full time,"bengaluru,kolkata",6
3,data engineer,senior data engineer,hyper think systems private limited,"azure datafactory,synapse,data validation","contract job,part time",,13
4,data engineer,aws data engineer,willware technologies private limited,"spark airflow,aws,python,sql","full time,work from home",chennai,7
5,data engineer,hiring big data engineer,epam systems india private limited,"""big data"",spark,scala,aws,sql",full time,,6
6,data engineer,data engineer,cgi,"airflow,teradata,ci/cd,oracle,hive,mongo",full time,hyderabad,5
7,data engineer,data engineer- obiee,ltimindtree limited,"business intelligence,obiee,data warehouse",full time,"mumbai,bengaluru",5
8,data engineer,big data engineer / apache spark,maneva consulting private limited,"junit,sdlc,git,jira",full time,"bengaluru,hyderabad",9
9,data engineer,ai data engineer,hnm solutions,"data bricks,azure services",full time,chennai,5
10,data engineer,manager-data engineer,genpact,"beautifulsoup,python,css,javascript",full time,kolkata,1
11,data engineer,senior software engineer - data engineer,cgi,"airflow,communication,azure data analytics architecture",full time,bengaluru,6
12,data engineer,ai data engineer,hnm solutions,"azure services,cloud,sql,python,databricks",full time,chennai,9
13,data engineer,data engineer - oacs,ltimindtree limited,"oacs,oac,oas,obiee",full time,mumbai,5
14,data engineer,aws data engineer,maverick edutech private limited,"spark,redshift,s3",full time,hyderabad,6
15,data engineer,senior data engineer,white horse manpower consultancy private limited,"semarchy mdm,informatica mdm,linux shell scripting",full time,"bengaluru,hyderabad",8
16,data engineer,senior data engineer,s&p global market intelligence,"snowflake,airflow,sql server,aws,python",full time,,6
17,data engineer,data engineer - data engineering,bristlecone,"big query,genomics,npl,sparkml,pub sub",full time,pune,8
18,data engineer,lead data engineer,s&p global market intelligence,"snowflake,airflow,sql server,aws,python",full time,,10
19,data engineer,python data engineer,cgi,"analytical abilities,hive,python,pyspark",full time,bengaluru,6
20,data engineer,data production engineer hdp/cdp,bnp paribas,"ansible tower,anaconda,cdp,acls,mattermost",full time,chennai,4
21,data engineer,gcr-go-data engineer-senior,ernst & young,"azure platform,ms excel,alteryx,erp,power bi",full time,bengaluru,6
22,data engineer,lead consultant- google cloud platform (gcp) data engineer,genpact,"etl processes,gcp services,dataprep,python",full time,hyderabad,1
23,data engineer,data engineer,company name confidential,"agile software,etl extract,etl tools,etl,dwh",full time,gurugram,9
24,data engineer,data engineer,s&p global market intelligence,"snowflake,airflow,ci/cd,sql server,agile",full time,,3
25,data engineer,snaplogic data engineer,yellow umbrella group,"snaplogic development,troubleshooting",full time,,10
26,data engineer,python data engineer,cgi,"hive,hadoop,pyspark,scala,jira,python",full time,hyderabad,6
27,data engineer,senior data engineer,s&p global market intelligence,"snowflake,airflow,sql server,aws,python",full time,,6
28,data engineer,"principal consultant, data engineer",genpact,"etl developer,azure sql database,okta",full time,bengaluru,1
29,data engineer,technical associate data engineer,genpact,,full time,hyderabad,0
30,data engineer,"principal consultant, data engineer",genpact,"etl developer,azure sql database,okta",full time,bengaluru,1
31,data engineer,staff engineer - data engineering,altimetrik,"database maintenance activity,google cloud db technologies",full time,chennai,0
32,data engineer,data engineer,cgi,"data catalog,hadoop,agile methodologies",full time,pune,6
33,data engineer,data engineer,synechron technologies private limited,"spark,hive,sqoop,kafka",full time,"chennai,pune",8
34,data engineer,data engineer ii/iii - oracle plsql,fedex logistics,"oracle supplied packages,oracle collection",full time,hyderabad,11
35,data engineer,gcp data engineer,ltimindtree limited,"""gcp"",python,sql,cloud computing",full time,mumbai,5
36,data engineer,pyspark developer,hnm solutions,"pyspark,nosql",full time,chennai,10
37,data engineer,data engineer,mobile programming llc,"sql,aws,pyspark",full time,,7
38,data engineer,data engineer,supernal infotech private limited,"aws glue,redshift,kinesis","contract job,part time",,7
39,data engineer,data engineer,synechron technologies private limited,"spark,hive,sqoop,kafka",full time,gurugram,8
40,data engineer,data engineer,tranquil hr solutions private limited,"spark,databricks",full time,chennai,5
41,data engineer,data engineer,v2 tech venture private limited,"snow flake,aws devops,aws,sql,python",full time,"mumbai,bengaluru",4
42,data engineer,"sr. data engineer (datawarehouse , etl , cloud ,pyspark ) 10+ years",western digital,"data modelling,pl/sql,oracle database management",full time,bengaluru,8
43,data engineer,internship - data engineer- python+sql,nextogen technologies private limited,"python,sql",full time,hyderabad,0
44,data engineer,data engineer,synechron technologies private limited,"spark,hive,sqoop,kafka",full time,"mumbai,bengaluru",8
45,data engineer,azure data engineer,company name confidential,"adf,azure data bricks,azure data lake,pyspark",full time,"bengaluru,hyderabad",9
46,data engineer,consulting-bo-cloud engineering-senior consultant-gcp big data data engineer-delhi,deloitte,apache spart/cdh/hdp/emr/google dataproc/hd-insights distributed processing,full time,delhi,6
47,data engineer,expert data engineer,schneider electric,"azure pipelines,github actions,r,ci/cd",full time,bengaluru,7
48,data engineer,junior data engineer,movate,"r,hive,python,tableau,spark,hadoop",full time,chennai,3
49,data engineer,consulting - bo: cloud engineering - consultant- data engineer,deloitte,"data lineage,data mapping,master data management",full time,bengaluru,9
50,data engineer,advisory-management-pyspark data engineer assistant manager,kpmg india,"data analysis,data science",full time,gurugram,1
51,data engineer,senior cloud data engineer,movate,"scikit-learn,azure sql database,azure synapse analytics",full time,chennai,7
52,data engineer,big data production support engineer,societe generale,"airflow,control-m,unix,hadoop,kafka",full time,bengaluru,1
53,data engineer,data engineer,hitachi energy,"enterprise service bus,azure data factory",full time,chennai,4
54,data engineer,senior engineer - data analytics,altimetrik,"mashups,extracting,loading,aws insight",full time,bengaluru,1
55,data engineer,senior staff engineer - data engineering,altimetrik,"data lineage,alation,axon,compliance",full time,bengaluru,7
56,data engineer,senior data engineer - data analytics competence gecia,atlas copco,"tibco data virtualisation,data modelling,power bi",full time,pune,2
57,data engineer,consulting-bo-cloud engineering-senior consultant-gcp big data data engineer-chennai,deloitte,"python,mysql,apache spark,sql server",full time,delhi,6
58,data engineer,consulting-bo-cloud engineering-aws data engineer-consultant,deloitte,"snowflake,cloudtrail,glue,aws,sql",full time,mumbai,4
59,data engineer,consultant -data engineer,genpact,"snowflake,stream-sets pipelines,data ingestion",full time,pune,1
60,data engineer,consulting-bo-cloud engineering-gcp data engineer-chennai,deloitte,"python,mysql,apache spark,sql server",full time,chennai,3
61,data engineer,data engineer-python,ntt data,"plotly dash,parquet,azure,python,pandas",full time,bengaluru,1
62,data engineer,azure data engineer,itc infotech india limited,"technical,infrastructure,cloud,azure",full time,bengaluru,0
63,data engineer,register now!,hinduja global solutions limited,"aws athena,aws cloud formation,spark data frames",full time,hyderabad,4
64,data engineer,hadoop developer,oracle,"data pipelines,data flow,analysis,core banking systems",full time,bengaluru,6
65,data engineer,data engineer,itc infotech india limited,etl | pyspark azure,full time,bengaluru,0
66,data engineer,azure data engineer,itc infotech india limited,"technical,app development,devops,azure devops",full time,bengaluru,0
67,data engineer,data engineer - azure,itc infotech india limited,"notebooks development,data bricks,azure",full time,gurugram,4
68,data engineer,sr. azure data engineer,tata consultancy services limited,,full time,"bengaluru,kolkata",7
69,data engineer,data engineer_dbt | permanent wfh/ remote,wovv technologies (division of techno compass consulting pvt ltd),"dbt,snowflake,data lakehouse,sql,aws","full time,work from home","chennai,mumbai",7
70,data engineer,snowflake data engineer (snowflake datawarehouse) lead,santo systems private limited,snowflake data warehouse,full time,bengaluru,13
71,data engineer,"data engineer (gis, arcgis, esri) | contractual | wfh/remote",wovv technologies (division of techno compass consulting pvt ltd),"gis,arcgis,esri,python,ms sql,talend","full time,work from home","chennai,mumbai",4
72,data engineer,azure data engineer,elite,azure,full time,"bengaluru,coimbatore",7
73,data engineer,urgent opening for the post of big data engineer for hyderabad location.,addon manpower solutions private limited,,full time,hyderabad,6
74,data engineer,azure data engineer,elite,,full time,coimbatore,8
75,data engineer,data engineer and dataware house,quess it staffing (formerly known as magna infotech),"dataware house,python,pyspark,sql queries",full time,hyderabad,7
76,data engineer,"senior engineer, data analytics engineering",western digital,"ci/cd,pyspark,cloud solutions,jenkins",full time,bengaluru,2
77,data engineer,urgent requirement wfh or remote c2c-azure cloud graph data engineer,mindpower hr solutions,graph database. graph modeling & ingestion. cypher/gql,full time,,10
78,data engineer,data engineer with python,hnm solutions,"python,aws,pyspark",full time,chennai,5
79,data engineer,senior manager _ cyber security _ data engineer _ pune,vodafone,"data processing,analytical tools",full time,pune,13
80,data engineer,data engineer ab initio,brain management consultants india private limited,"ab initio gde,ab initio,abinitio",full time,"bengaluru,gurugram",6
81,data engineer,data engineer,synechron technologies private limited,"python,scala,sql",full time,"delhi,kolkata",6
82,data engineer,"data engineer (gis, arcgis, esri) | contractual | wfh/remote",wovv technologies (division of techno compass consulting pvt ltd),"gis,arcgis,esri,python,ms sql,talend","full time,work from home","chennai,mumbai",4
83,data engineer,data engineer,aequor information technologies priivate limited,"python,pyspark","full time,work from home","chennai,bengaluru",9
84,data engineer,data engineer,hnm solutions,pyspark,full time,chennai,10
85,data engineer,data engineer,synechron technologies private limited,"python,scala,sql",full time,"pune,bengaluru",6
86,data engineer,senior data engineer,white horse manpower consultancy private limited,"power informatica,oracle,sql server,sdlc process",full time,bengaluru,10
87,data engineer,data engineer,ericsson,"elasticsearch,kibana,pandas,mlops,numpy",full time,bengaluru,5
88,data engineer,azure data engineer,elite,,full time,bengaluru,7
89,data engineer,urgent opening for the post of big data engineer for hyderabad location.,addon manpower solutions private limited,,full time,hyderabad,6
90,data engineer,data engineer_dbt | permanent wfh/ remote,wovv technologies (division of techno compass consulting pvt ltd),"dbt,snowflake,data lakehouse,sql,aws","full time,work from home","chennai,mumbai",7
91,data engineer,data engineer,hitachi energy,"enterprise service bus,azure data factory",full time,chennai,4
92,data engineer,engineer - data engineering,altimetrik,"data pipeline development,performance optimization",full time,bengaluru,1
93,data engineer,big data engineer senior advisor,dell,"data processing,streaming,hadoop,flume",full time,bengaluru,7
94,data engineer,data engineer,brillio,"spark mllib,spark batch,flink,java,spark sql",full time,bengaluru,5
95,data engineer,data engineer,hitachi energy,"enterprise service bus,azure data factory",full time,chennai,4
96,data engineer,data engineer iii,walmart,"problem solving,functional programing,data ingestions",full time,bengaluru,4
97,data engineer,sr. data engineer,cgi,"airflow,data orchestration,azure data analytics architecture",full time,bengaluru,6
98,data engineer,"azure data engineer - azure adf, azure databricks, sql",cgi,"azure data factory,azure data lake,python",full time,bengaluru,1
99,data engineer,staff engineer - data analytics engineering,western digital,"airflow,columnar database environment",full time,bengaluru,7
100,data engineer,asst. manager - aws data engineer,genpact,"athena,glue,aws,sql,etl,s3,python",full time,bengaluru,1
101,data engineer,data engineer,ericsson,"elasticsearch,kibana,pandas,mlops,numpy",full time,bengaluru,5
102,data engineer,data engineer,hitachi energy,"t-sql solutions,problem-solving,communication",full time,chennai,4
103,data engineer,big data engineer - lead,harman international,"database schema design,reusable code/component",full time,bengaluru,6
104,data engineer,"staff engineer, data analytics engineering",western digital,"splunk/grafana,data frames,relational database systems",full time,bengaluru,7
105,data engineer,senior data engineer,altimetrik,"airflow,snowflake,hadoop,gcp,spark",full time,bengaluru,6
106,data engineer,aws data engineer,kaizen sra technologies private limited,"airflow,python,pyspark,aws,oozie",full time,bengaluru,6
107,data engineer,react native onsite job for it gcp data engineer usa h1b visa,vaakruthi software solutions,react native,full time,"bengaluru,hyderabad",8
108,data engineer,azure data engineer - manager - bangalore (job code : j47642),sampoorna consultants private limited,"databricks,adf",full time,bengaluru,12
109,data engineer,azure data engineer,aequor information technologies priivate limited,,full time,chennai,7
110,data engineer,onsite job for it gcp data engineer usa h1b visa,vaakruthi software solutions,salesforce,full time,"bengaluru,hyderabad",6
111,data engineer,data flow engineer,prt software solutions llp,"data flow,cloud certification,gcp,java",full time,bengaluru,8
112,data engineer,gcp data engineer,synechron technologies private limited,,full time,pune,9
113,data engineer,azure data engineer,covalense technologies private limited,"""databricks"",""data bricks""",full time,bengaluru,9
114,data engineer,data engineer,dmaic academy and consultancy,"databrick,python,pyspark",full time,coimbatore,9
115,data engineer,l3 data center engineer,htis telecom private limited,"hardware,datacenter,nexus,it infrastructure",full time,"chennai,mumbai",15
116,data engineer,azure / aws developer + ai + data engineer,lyros technologies private limited,"azure cognitive services,azure machine learning",full time,chennai,5
117,data engineer,data engineer with azure,erm placement services private limited,pyspark,full time,bengaluru,6
118,data engineer,data engineer,v2 tech venture private limited,"databricks,aws,aws glue",full time,"mumbai,bengaluru",6
119,data engineer,bi data engineer,highpoints technologies india private limited,,full time,gurugram,7
120,data engineer,"azure , data engineer",elite,azure,full time,coimbatore,4
121,data engineer,data engineer - oacs,ltimindtree limited,"oacs,oac,oas",full time,mumbai,5
122,data engineer,data science engineer,electrobrain modern technologies private limited,pythondata miningproblem solvingsqldata science pysparkalgorithmsnatural language processingteam handlingtime seriesnosqlanalyticsdeep learningregressionlogistic regressionmongodb,full time,pune,5
123,data engineer,gcp data engineer,adept strategic human resources management,"airflow,gcp,workflow",full time,bengaluru,11
124,data engineer,sr. azure data engineer.,happy square outsourcing services private limited,"url,azure cloud,azure,aws,databricks",full time,mumbai,8
125,data engineer,azure data engineer,elite,,full time,coimbatore,7
126,data engineer,sr azure data engineer,company name confidential,"data processing,databrick,data structures",full time,pune,6
127,data engineer,azure data engineer - consultant - blr (job code : j47638),sampoorna consultants private limited,azure,full time,bengaluru,5
128,data engineer,data engineer looking for 4 plus years hyderabad location work from office,mindquest software solutions private limited,,full time,hyderabad,5
129,data engineer,gcp data engineer,adept strategic human resources management,"gcp,docker,kubernetes",full time,bengaluru,9
130,data engineer,data integration engineer,electrobrain modern technologies private limited,"relationship building,manager technology",full time,pune,6
131,data engineer,azure data engineer,tiyasha software private limited,"azure,sql,etl",full time,mumbai,9
132,data engineer,data engineer,highpoints technologies india private limited,,full time,"bengaluru,hyderabad",9
133,data engineer,data engineer and senior data engineer,tiyasha software private limited,"azure data factory,azure synapse",full time,mumbai,6
134,data engineer,data engineer,highpoints technologies india private limited,"etl,ssis,adf,sql",full time,"bengaluru,hyderabad",7
135,data engineer,data engineer,neugene international inc,"etl,informatica",full time,"chennai,bengaluru",7
136,data engineer,engineer - data engineering,altimetrik,"performance optimization,data pipeline development",full time,chennai,1
137,data engineer,data assurance engineer iii,walmart global tech india,,full time,bengaluru,0
138,data engineer,azure data engineer,gspann technologies,"azure blob storage,azure data factory,azure data lake",full time,"gurugram,hyderabad",10
139,data engineer,engineer - data engineering,altimetrik,"performance optimization,data pipeline development",full time,bengaluru,1
140,data engineer,data engineer iii,walmart global tech india,"airflow,metadata driven development,statistics",full time,chennai,4
141,data engineer,data assurance engineer iii,walmart,"standard operating procedures,insider threat investigations",full time,chennai,6
142,data engineer,"(ind) senior, data engineer",walmart global tech india,"big query,airflow,data migration protocols",full time,bengaluru,4
143,data engineer,azure data engineer,icube consulting services india private limited,"azure services,datalake,logic apps,poweer apps",full time,"bengaluru,hyderabad",5
144,data engineer,pyspark,hnm solutions,"nosql,aws,hadoop",full time,chennai,8
145,data engineer,h1b visa sponsorship for it professionals for snowflake data engineer,intalent llc,"snow flake,could data warehousing. datawarehouse",full time,hyderabad,9
146,data engineer,data engineer iii,walmart global tech india,"r,plotly,looker,matplotlib,powerbi,seaborn",full time,bengaluru,3
147,data engineer,consulting-bo-cloud engineering-senior consultant-gcp data engineer,deloitte,,full time,bengaluru,0
148,data engineer,data engineer,eaton,"alation,metadata,analytical modeling,taxonomies",full time,pune,4
149,data engineer,"sr. data engineer (datawarehouse , etl , cloud ,pyspark )",western digital,"data mapping,data lakes,metadata,erp systems",full time,bengaluru,8
150,data engineer,gcp data engineer | 6 to 12 years | pan india,capgemini,"gcs,composer,gcp,sql,bigquery,java",full time,kolkata,3
151,data engineer,data engineer,cgi,data analysis,full time,pune,6
152,data engineer,senior data engineer,eaton,"aws athena,apache presto,zeppelin,azure eventhubs",full time,pune,5
153,data engineer,sr. data warehouse engineer (10+ year exp),western digital,"advanced pl/sql,odi,pl/sql,power bi",full time,bengaluru,8
154,data engineer,"sr. data engineer (datawarehouse , etl , cloud ,pyspark )",western digital,"data mapping,data lakes,metadata,erp systems",full time,bengaluru,8
155,data engineer,principal consultant-senior data engineer,genpact,"python,sql,graph databases,aws,etl",full time,pune,7
156,data engineer,data engineer iii,walmart global tech india,"airflow,metadata driven development,statistics",full time,chennai,4
157,data engineer,principal consultant - google cloud platform (gcp) data engineer,genpact,"dataprep,data integration",full time,bengaluru,1
158,data engineer,data engineer,ericsson,"big query,application environments,gcp bucket",full time,,11
159,data engineer,senior data integration engineer (informatica cdgc),coforge,"etl design knowledge,axon,informatica integration",full time,hyderabad,9
160,data engineer,principal consultant-lead data engineer,genpact,"python,sql,graph databases,aws,etl",full time,bengaluru,7
161,data engineer,technical associate - data and integration engineer,genpact,"batches,async programming,api,sql",full time,,1
162,data engineer,lead consultant-dbt data engineer,genpact,"python,sql,graph databases,aws,etl",full time,bengaluru,1
163,data engineer,project engineer - data engineering,hitachi energy,"relational database access programming,iec cim",full time,bengaluru,3
164,data engineer,senior manager_project manager_gcp sr. data engineer/gcp architect_d&a_pune,vodafone,"big query,cloud spanner,gcp compute",full time,pune,8
165,data engineer,gcp data engineer | 6 to 12 years | pan india,capgemini,"gcs,composer,gcp,sql,bigquery,java",full time,kolkata,3
166,data engineer,consulting - sa&ma - stream data engineer,deloitte,"atscale,gcp,bigquery,sql,etl,python",full time,delhi,1
167,data engineer,"(ind) senior, data engineer",walmart global tech india,"big query,airflow,data migration protocols",full time,bengaluru,4
168,data engineer,senior data engineer,oracle,"business intelligence,sql,data science,etl",full time,hyderabad,1
169,data engineer,"vice president, data engineer â etl architecture",blackrock,"snowpark,dbt,snowflake,pyspark,kafka",full time,gurugram,6
170,data engineer,senior machine learning engineer/data scientist,oracle,"availability,engineering,security,enterprise engineering",full time,bengaluru,6
171,data engineer,consulting - bo - cloud engineering - senior consultant - azure data engineer hdfc,deloitte,"ms sql rdbms,sql query language,data warehouse transformation processes",full time,mumbai,7
172,data engineer,data engineer,hewlett packard enterprise,"airflow,workflow tools,sql,hive,python",full time,bengaluru,6
173,data engineer,"associate, data engineer",blackrock,"big query,airflow,great expectations,object-oriented design patterns",full time,gurugram,2
174,data engineer,senior data engineer - data analytics competence gecia,atlas copco,"ac,tibco data virtualisation,data virtualisation",full time,pune,2
175,data engineer,consulting - bo: cloud engineering - senior consultant- ml ops data engineer,deloitte,"airflow,kubeflow,go,scikit-learn,mlflow",full time,bengaluru,6
176,data engineer,consulting-et&p-emerging erp - data engineer - consultant,deloitte,,full time,pune,0
177,data engineer,consulting-et&p-emerging erp - data engineer - senior consultant,deloitte,,full time,pune,0
178,data engineer,gcp cloud data engineer,cognizant,"google cloud infra,google cloud native dev",full time,bengaluru,10
179,data engineer,"data engineer, gtech analytics, platforms and tools",google,"organizational skills,data models,structured and unstructured sources",full time,gurugram,3
180,data engineer,consulting-et&p-emerging erp - data engineer - consultant,deloitte,,full time,pune,0
181,data engineer,data engineer - azure,itc infotech india limited,"blob storage,power-bi,delta lake,devops pipeline",full time,bengaluru,4
182,data engineer,senior data engineer (pyspark),cognizant,"pyspark,sql,aws glue",full time,hyderabad,3
183,data engineer,data engineer - aws pyspark developer,cognizant,"parquet,orc,aws,sql,bash,csv,json",full time,gurugram,6
184,data engineer,"data engineer, youtube",google,"business and technical communication,organizational",full time,bengaluru,6
185,data engineer,lead engineer - electrical (data centre),jacobs,"electrical,revit,dialux,ac/dc sld""s,hv/lv cable",full time,gurugram,17
186,data engineer,senior data engineer,oracle,"business intelligence,sql,data science,etl",full time,hyderabad,1
187,data engineer,walk-in drive_data engineer_coimbatore on 6th & 7th november ( tuesday & wednesday ),renault nissan technology & business centre india private limited,"big data,sql",full time,chennai,4
188,data engineer,sr. data engineer,d square consulting services private limited,"snow flake,domo,sql,etl",full time,bengaluru,7
189,data engineer,sr. data engineer,d square consulting services private limited,"snow flake,domo,sql,tableau,etl",full time,bengaluru,7
190,data engineer,data science engineer,electrobrain modern technologies private limited,pythondata miningproblem solvingsqldata science pysparkalgorithmsnatural language processingteam handlingtime seriesnosqlanalyticsdeep learningregressionlogistic regressionmongodb,full time,"gurugram,hyderabad",5
191,data engineer,"spark,pyspark,scala,sql,senior data engineer , 7 - 11 years",nedo consultancy,"spark,pyspark,scala",full time,hyderabad,9
192,data engineer,walkin for senior data engineer at hyderabad on 28th oct'23,renault nissan technology & business centre india private limited,"sql,big data,bigdata",full time,"chennai,hyderabad",4
193,data engineer,sr. data engineer,d square consulting services private limited,"snow flake,domo,sql,tableau,etl",full time,bengaluru,7
194,data engineer,data engineer,hireign innoways (opc) private limited,"sql,python",full time,hyderabad,7
195,data engineer,data integration engineer,electrobrain modern technologies private limited,"relationship building,manager technology",full time,"chennai,delhi",6
196,data engineer,data engineer,kudzuinfotech private limited,"pyspark,python,sql",full time,bengaluru,7
