job_title,company,experience,salary,locations,description,industry,department,employment_type,skills,scraped_at
Business Operations Senior Analyst,"NTT DATA, Inc.",5 - 8 years,Not Disclosed,"['Gurugram', 'Bengaluru']","AO - Business Operations Sr. Analyst\nThe Client Management Services organization supports our NTT DATA Account Leaders in Contract Management, Account Governance and Business Process Compliance activities to enable timely order-to-cash process and effective coordination between Sales, Forecasting, ERP and Resourcing actions. The primary objective of this group is enabling Client Managers to focus on account growth by supporting account operations/administrative activities, improving processes/data/ compliance/awareness within or across accounts, providing proactive insights and supporting actions related to org-wide initiatives. The AO Organization Business Support Team is responsible for overall contract setup and management support, account operations tracking, process compliance activities and client onboarding activities. The AO Operations Sr. Analyst/Sr. Analyst supports key processes for a portfolio of accounts reporting to the Operations Manager/Sr. Manager\nJob Responsibilities:The incumbent may be required to perform all or a combination of the following essential functions as determined by business necessity\nResource who has strong process/business knowledge and experience with E2E of Order-to-Cash processes and functional knowledge of each of the sub-streams of Order to Cash.\nAs part of daily production activities: -\nUnderstanding and setting up newly received contracts/projects in the system (SAP, Peoplesoft etc.) and performing their maintenance activities as and when required. This requires accurately understanding and interpreting supporting documents.\nCo-ordinate with all O2C sub streams to ensure accurate and timely invoicing to the customer\nConstant reduction of unbilled items\nDelivering upon the SLAs and KPIs of the team from production standpoint.\nGetting on calls, discussions and meetings with Delivery managers, Project Managers, Vertical CFOs, Financial analysts and other key stake holders to maintain smooth communication of operational activities on a daily basis.\nResponsible for account operations tracking, process compliance activities and repeatable administrative actions with minimal coordination or ambiguity related to the process areas\nSomeone with analytical bent of mind who can work on providing continuous improvement ideas and has a considerable knowledge of revenue recognition methods from an accounting standpoint.\nWorks with leadership team to provide feedback, identifying training needs and perform root cause analysis for iterations/escalations\nWorks closely with different teams like resource mgmt., revenue, finance to ensure smooth month, quarter & year end closing process\nTechnical Skills\nProficient with MS office suite (MS Excel, MS outlook etc)\nAbility to use systems effectively for Projects/Time/Resource management and other functions\nExperience / Exposure on with SAP and Saleforce.com will be an added advantage\nFunctional Skills\n5 to 6 plus years of experience in at least one of the process areas Project/Time, Contracts/Invoicing/AR is preferred, Order management and master data management will be preferred\nResource who has strong process/Business knowledge and experience with Order-to-Cash process\nConducting UAT and securing Sign Offs for new requirements under supervision of Technical team/Lead\n1+ years of Operations or Back-office Support Services experience is preferred\nStrong communication (verbal and written) & analytical skills and the ability to understand complex business problems and propose solutions.\nManagement Skills\nSelf-managed individual who can effectively organize and manage activities, drive attention to detail, ensure quality of deliverables and optimize results\nFlexible to business requirements\nCoordinate with internal resources and stakeholders for the flawless execution of work\nEffectively communicating your insights and plans to cross-functional team members and management\nMonitoring deliverables and ensuring timely completion of change requests/requirements\nMaintaining SLAs and resolving issues within SLA\nCore Competencies\nEffective People Management skills with experience of independent team handling for at least 1-3 years.\nDrive strong performance management within the team for achieving team targets, maintaining optimum production standards and driving efficiency within the team\nUsing Leadership skills and change management for advocacy of organisational objectives\nStrong business acumen with ability to drive zero surprise operations and un-interrupted production.\nUsing innovation and initiative as tools for driving process improvements .\nDriving a strong channel of communication for effective stakeholder management.\nLocation -Gurgaon/Bangalore",Industry Type: IT Services & Consulting,Department: Data Science & Analytics,"Employment Type: Full Time, Permanent","['Business Operations', 'process compliance', 'stakeholder management', 'UAT', 'performance management', 'change management']",2025-06-12 00:48:54
Claims Business Process Analyst Senior,Optum,1 - 4 years,Not Disclosed,['Bengaluru'],"Optum is a global organization that delivers care, aided by technology to help millions of people live healthier lives. The work you do with our team will directly improve health outcomes by connecting people with the care, pharmacy benefits, data and resources they need to feel their best. Here, you will find a culture guided by inclusion, talented peers, comprehensive benefits and career development opportunities. Come make an impact on the communities we serve as you help us advance health optimization on a global scale. Join us to start  Caring. Connecting. Growing together. \n\n  \n\n Primary Responsibilities: \nReview and resolve complex cases with an end to end mindset to prevent issues or inquiries from recurring. Scope open inventory for like issues for cases worked to group and resolve batches.\nDemonstrate a knowledge of end-to-end processes of multiple different types of capitated and delegated arrangements within the Value Based Care Model\nIdentify and articulate trends occurring within a risk entity or across multiple risk entities within claims processing and cost share application\nIdentify and articulate trends with our assigned delegates with the Sr. Issue Resolution Analyst and partner to work towards shift left initiatives\nPartner and collaborate internally and with Risk Entities to correct claims processing and cost share application errors to prevent recurring issues. Actively participate in meetings with cross functional areas aligned by risk entities to share findings\nIdentify and communicate opportunities for improving issue resolution processes, including automation. Clearly document findings and solutions for trended issues after performing root cause analysis\nPerform reconciliation of member inquiry cases, respond to the specific issue of the inquiry, as well as review for and resolve other issues that may be present for the member, outside of the inquiry\nSupport and communicate with the Sr. Issue Resolution Analyst assigned to your Delegate. Perform root cause and trend analysis of issues by assigned Delegate. Clearly document findings and solutions to prevent future issues\nCommunicate effectively (both written and verbal) with business partners\nManages emotions effectively in high-pressure situations, maintaining composure, and fosters a positive work environment conducive to collaboration and productivity\nComply with the terms and conditions of the employment contract, company policies and procedures, and any and all directives (such as, but not limited to, transfer and/or re-assignment to different work locations, change in teams and/or work shifts, policies in regards to flexibility of work benefits and/or work environment, alternative work arrangements, and other decisions that may arise due to the changing business environment). The Company may adopt, vary or rescind these policies and directives in its absolute discretion and without any limitation (implied or otherwise) on its ability to do so\n\n Required Qualifications: \nDegree or equivalent data science, analysis, mathematics experience\nExperience supporting operational teams' performance with reports and analytics\nExperience using Word (creating templates/documents), PowerPoint (creation and presentation), Teams, and SharePoint (document access/storage, sharing, List development and management)\nBasic understanding of reporting using Business Insights tools including Tableau and PowerBI\nExpertise in Excel (data entry, sorting/filtering) and VBA\nProven ability to work across lines of business, claims platforms and on service provider/Delegate issues as needed\nProven solid communication skills including oral, written, and organizational skills",Industry Type: Retail,Department: Data Science & Analytics,"Employment Type: Full Time, Permanent","['power bi', 'sharepoint', 'tableau', 'vba', 'business insights', 'screening', 'presentation skills', 'business analysis', 'variance analysis', 'hrsd', 'business process analysis', 'sourcing', 'sql', 'claims processing', 'talent acquisition', 'data science', 'recruitment', 'trend analysis']",2025-06-12 00:48:58
Claims Business Process Analyst Senior,Optum,1 - 4 years,Not Disclosed,['Bengaluru'],"Optum is a global organization that delivers care, aided by technology to help millions of people live healthier lives. The work you do with our team will directly improve health outcomes by connecting people with the care, pharmacy benefits, data and resources they need to feel their best. Here, you will find a culture guided by inclusion, talented peers, comprehensive benefits and career development opportunities. Come make an impact on the communities we serve as you help us advance health optimization on a global scale. Join us to start Caring. Connecting. Growing together.\n\nPrimary Responsibilities:\nReporting Development and Data Integration\nAssist with data projects related to integration with our core claims adjudication engines, eligibility, and other database items as necessary\nSupport the data leads by producing ad hoc reports as needed based on requirements from the business\nReport on key milestones to our project leads\nEnsuring all reporting aligns with brand standards\nEnsuring PADU guidelines for tools, connections, and data security\nBuild a network with internal partners to assist with validating data quality\nAnalytical Skills Utilization\nApplying analytical skills and developing business knowledge to support operations\nIdentify automation opportunities through the trends and day to day tasks to help create efficiencies within the team\nPerform root cause analysis via the 5 why root causing to identify process gaps and initiate process improvement efforts\nAssist with user testing for reports, business insights dashboards, and assist with automation validation review\nComply with the terms and conditions of the employment contract, company policies and procedures, and any and all directives (such as, but not limited to, transfer and/or re-assignment to different work locations, change in teams and/or work shifts, policies in regards to flexibility of work benefits and/or work environment, alternative work arrangements, and other decisions that may arise due to the changing business environment). The Company may adopt, vary or rescind these policies and directives in its absolute discretion and without any limitation (implied or otherwise) on its ability to do so\n\nRequired Qualifications:\nDegree or equivalent data science, analysis, mathematics experience\nExperience supporting operational teams' performance with reports and analytics\nExperience using Word (creating templates/documents), PowerPoint (creation and presentation), Teams, and SharePoint (document access/storage, sharing, List development and management)\nBasic understanding of reporting using Business Insights tools including Tableau and PowerBI\nExpertise in Excel (data entry, sorting/filtering) and VBA\nProven solid communication skills including oral, written, and organizational skills\nProven ability to manage emotions effectively in high-pressure situations, maintaining composure, and fosters a positive work environment conducive to collaboration and productivity\nPreferred Qualifications:\nExperience leveraging and creating automation such as macros, PowerAutomate, Alteryx/ETL Applications\nExperience working with cloud-based servers, knowledge of database structure, stored procedures\nExperience performing root cause analysis and demonstrated problem solving skills\nKnowledge of R/Python, SQL, DAX or other coding languages\nKnowledge of multiple lines of business, benefit structures and claims processing systems",Industry Type: Retail,Department: Data Science & Analytics,"Employment Type: Full Time, Permanent","['power bi', 'sql', 'alteryx', 'tableau', 'vba', 'python', 'macros', 'dbms', 'sharepoint', 'process improvement', 'business process analysis', 'root cause analysis', 'dashboards', 'stored procedures', 'data quality', 'r', 'data science', 'business insights', 'dax', 'etl', 'data integration']",2025-06-12 00:49:02
Senior Data Scientist,"NTT DATA, Inc.",2 - 6 years,Not Disclosed,['Bengaluru'],"Your day at NTT DATA\nThe Senior Data Scientist is an advanced subject matter expert, tasked with taking accountability in the adoption of data science and analytics within the organization.\n\nThe primary responsibility of this role is to participate in the creation and delivery of data-driven solutions that add business value using statistical models, machine learning algorithms, data mining, and visualization techniques.\n\nKey responsibilities:\nDesigns, develops, and programs methods, processes, and systems to consolidate and analyze unstructured, diverse big data sources to generate actionable insights and solutions for client services and product enhancement.\nDesigns and enhances data collection procedures to include information that is relevant for building analytic systems.\nResponsible for ensuring that data used for analysis is processed, cleaned and, integrally verified and build algorithms necessary to find meaningful answers.\nDesigns and codes software programs, algorithms, and automated processes to cleanse, integrate and evaluate large datasets from multiple disparate sources\nProvides meaningful insights from large data and metadata sources; interprets and communicates insights and findings from analysis and experiments to product, service, and business managers.\nDirects scalable and highly available applications leveraging the latest tools and technologies.\nAccountable for creatively visualizing and effectively communicating results of data analysis, insights, and ideas in a variety of formats to key decision-makers within the business.\nCreates SQL queries for the analysis of data and visualizes the output of the models.\nResponsible for ensuring that industry standards best practices are applied to development activities.\n\nTo thrive in this role, you need to have:\nAdvanced understanding of data modelling, statistical methods and machine learning techniques.\nStrong ability to thrive in a dynamic, fast-paced environment.\nStrong quantitative and qualitative analysis skills.\nDesire to acquire more knowledge to keep up to speed with the ever-evolving field of data science.\nCuriosity to sift through data to find answers and more insights.\nAdvanced understanding of the information technology industry within a matrixed organization and the typical business problems such organizations face.\nStrong ability to translate technical findings clearly and fluently to non-technical team business stakeholders to enable informed decision-making.\nStrong ability to create a storyline around the data to make it easy to interpret and understand.\nSelf-driven and able to work independently yet acts as a team player.\n\nAcademic qualifications and certifications:\nBachelors degree or equivalent in Data Science, Business Analytics, Mathematics, Economics, Engineering, Computer Science or a related field.\nRelevant programming certification preferred.\nAgile certification preferred.\n\nRequired experience:\nAdvanced demonstrated experience in a data science position in a corporate environment and/or related industry.\nAdvanced demonstrated experience in statistical modelling and data modelling, machine learning, data mining, unstructured data analytics, natural language processing.\nAdvanced demonstrated experience in programming languages (R, Python, etc.).\nAdvanced demonstrated experience working with and creating data architectures.\nAdvanced demonstrated experience with extracting, cleaning, and transforming data and working with data owners to understand the data.\nAdvanced demonstrated experience visualizing and/or presenting data for stakeholder use and reuse across the business.",Industry Type: IT Services & Consulting,Department: Data Science & Analytics,"Employment Type: Full Time, Permanent","['Data Science', 'data analytics', 'natural language processing', 'data modeling', 'data mining', 'statistical modeling', 'data architecture', 'machine learning']",2025-06-12 00:49:05
Data Analyst /Science executive,Hav2 Apparels,2 - 5 years,1.75-2.5 Lacs P.A.,"['Bengaluru( Kundalahalli, AECS Layout, Munnekollal, Whitefield )']","Build and run scripts to scrape emails, phone numbers, and business data, clean and organize it, analyze insights using Python/Excel, automate workflows, and support lead generation for import-export operations.",Industry Type: Import & Export,Department: Data Science & Analytics,"Employment Type: Full Time, Permanent","['basic data analysis', 'Attention to Detail', 'Excel proficiency', 'regex knowledge', 'experience extracting emails/phones', 'Email Marketing', 'Numpy', 'and ability to automate and document tasks.', 'Beautiful Soup', 'CRM Management', 'Pandas', 'Data Scraping', 'Selenium', 'Python']",2025-06-12 00:49:09
Document Controller,Larsen & Toubro (L&T),0 - 2 years,3.5-4 Lacs P.A.,['Vadodara'],"Technical Expertise\nProficient in Document Management Systems and Engineering Data Warehouses.\nKnowledge of Document Numbering, Receipt Formatting, Filing Structure, and Registration.\nUnderstanding of Tagging Specification and Philosophy.\nExpertise in Document Distribution, including distribution matrices, electronic/hard copies, and transmittals.\nSkilled in Revision Management, Comment Handling, and Status Reporting.\nExperience in Correspondence, Technical Queries, Action Tracking, and Data Management.\nEngineering & Data Interpretation\nAbility to interpret engineering drawings such as P&IDs, PEFS, and PFDs.\nProficient in technical data extraction from:\nMachine drawings\nPEFS (Process Engineering Flow Scheme)\nSeal gas, lube oil, and instrument P&IDs\nVibration & temperature P&IDs\nAlarm/trip matrices, performance curves, and data sheets.\nExperience in Building Asset Registers and Equipment Record Cards.\nComprehensive knowledge of plant equipment and systems.\nIndustry Experience & Technical Tools\nExtensive experience in the Oil & Gas (O&G) industry.\nStrong interpersonal skills for effective communication and collaboration.\nProficient in MS Access and Advanced Excel for data analysis and reporting.",Industry Type: Engineering & Construction,Department: Project & Program Management,"Employment Type: Full Time, Temporary/Contractual","['Document Control', 'Document controller', 'Document Management System', 'Data Control', 'EDMS', 'Aconex', 'Dms', 'Document Management']",2025-06-12 00:49:11
Associate Product Manager,Cointab Software,0 - 1 years,3-4 Lacs P.A.,"['Mumbai', 'Goregaon']","Role Overview:\nAs an Associate Product Manager at Cointab, you will take complete ownership of managing and driving product initiatives from ideation to execution. Working closely with the Software Engineering and Infrastructure team, you will be responsible for defining product requirements, overseeing implementation, and ensuring seamless collaboration between technical and business teams. You will analyze data, create wireframes, document business needs, and make strategic decisions to improve the product. This role is ideal for fresh engineering graduates who are eager to lead product development, take initiative, and drive impact in a fast-paced environment.\n\nKey Responsibilities:\n\n1. Product Management & Strategy\nUnderstand product requirements and work with engineering teams to ensure successful implementation.\nConduct market research and competitor analysis to identify product gaps and opportunities.\nCollaborate with stakeholders to gather feedback and translate it into actionable product enhancements.\nAssist in defining the product roadmap and ensuring timely execution of product initiatives.\n2. Task & Project Management\nAssist in managing and tracking Software Engineering (SE) & Infrastructure (Infra) tasks.\nHelp assign technical tasks/tickets to relevant team members.\nDocument well-defined tasks, ensuring clarity in descriptions.\nWork with different teams to ensure timely execution of product initiatives.\n3.Wireframing & UI/UX Collaboration\nLearn and use wireframing tools like Figma, Balsamiq, or similar.\nWork with designers and developers to refine user interface (UI) and experience (UX) elements.\n4.Business Requirements & Documentation\nHelp in developing Business Requirement Documents (BRD) to bridge business needs and technical implementation.\nTranslate business goals into technical requirements with guidance from senior team members.\nDocument product features, workflows, and processes to maintain clear communication across teams.\n5. Data Analysis & Product Improvement\nAnalyze user behavior and product performance to drive data-driven decision-making.\nConduct research on market trends and competitor products to identify gaps and opportunities.\nWork with the Data Analysis (DA) team to leverage insights for product enhancements.\n\n\nSkills & Qualifications:\nB.E./B.Tech in Computer Engineering or a related field.\nBasic understanding of software development and infrastructure concepts.\nStrong analytical and problem-solving skills with an interest in data-driven decision-making.\nGood organizational skills to manage multiple tasks effectively.\nInterest in UI/UX design and ability to learn wireframing tools.\nGood documentation skills ability to write clear and structured task descriptions.\nProficiency in task management tools (e.g., Jira, Trello, or Mattermost Board) is a plus.\nEffective communication skills to collaborate with different teams.",Industry Type: IT Services & Consulting,Department: Product Management,"Employment Type: Full Time, Permanent","['Product Management', 'Software Development Life Cycle', 'Wireframing', 'Brd', 'Market Research And Analysis', 'Product Strategy', 'Trello', 'Product Roadmap', 'JIRA', 'Product Life Cycle', 'Balsamiq', 'Product Development', 'Task Documentation', 'Figma', 'Product Life Cycle Management', 'Competitive Analysis']",2025-06-12 00:49:14
MIS Executive (Fresher / Exp) B.SC Statistics / Math,Sarika Consultant Services,0 - 2 years,1.8-2.4 Lacs P.A.,['Kolkata( Gariahat )'],B.Sc Math or Stat must be needed\nFresher & experienced both can apply\nResponsibilities:\n* Analyze data using advanced Excel & Google Sheets skills.\n* Prepare monthly reports with statistical insights.\nCALL - 8697666885 or WhatsApp any queries\n\n\nHealth insurance\nProvident fund\nAnnual bonus,Industry Type: Industrial Equipment / Machinery,Department: Data Science & Analytics,"Employment Type: Full Time, Permanent","['Google Sheets', 'MIS', 'Advanced Excel', 'Mathematics', 'Statistics']",2025-06-12 00:49:17
OMNI Channel Manager,Titan Company,7 - 10 years,17-20 Lacs P.A.,['Bengaluru'],"OMNI Channel Manager\nBusiness IBD Job Description: We are seeking a highly skilled and dynamic Omni-Channel Manager to join our growing international business division. This individual will be responsible for overseeing, optimizing the customer journey across all online, and offline touchpoints. The role will focus on integrating e-commerce platforms, brick-and-mortar stores, and other sales channels to deliver a seamless, efficient, and personalized experience for our global customer base.\nKey Responsibilities:\n1. Omni-Channel Strategy Development & Execution:\nDevelop and implement a comprehensive Omni-channel strategy for IBD, ensuring an integrated and consistent customer journey across all touchpoints (online, offline, social media, customer service) etc. Drive the seamless integration of the brand’s e-commerce platform with retail stores, improving both online and in-store customer experience",,,,"['Channel Growth', 'E-Com & OMNI sales', 'Omni-Channel Strategy Development & Execution', 'Lead Management', 'Sales Optimization', 'Business Strategy']",2025-06-12 00:49:21
