job_title,company,experience,salary,locations,description,industry,department,employment_type,skills,scraped_at
Financial Analysis Specialist,"NTT DATA, Inc.",0 - 3 years,Not Disclosed,['Bengaluru'],"Provides support to sales bid teams (deal teams) through financial model development, risk assessment, pricing analysis and contract close-out. Manages the scope, quality, risks, schedule, and resources of company-wide pricing initiatives. Provides guidance and management to measure the effectiveness of the analyses being performed. Analyzes current and historical results of pricing activity and transactional data to identify actionable opportunities, develop ideas, and make recommendations to improve pricing performance. Examines opportunities to expand initiatives, processes and best practices while ensuring alignment with relevant businesses policies.\nAble to build the deal assessment financial model using appropriate toolset, following all guidelines\nAble to perform basic cost analysis on the solution model\nWell trained on all the tools\nFair understanding of all the relevant policies and its application thereof\nWell trained on the company""™s accounting policies and application on deals\nProduces pricing templates in collaboration with sales team\nHas an understanding of the contractual Terms & Conditions (T&Cs) and know our standard position\nMakes sure the governance process is followed as documented\nTypically requires 0-3 years relevant experience.\nUndergraduate degree or equivalent combination of education and work experience.\nGraduate degree (like MBA/MS Finance) or professional certification (like CPA/CA/CMA) preferred\nPossesses and applies knowledge of financial and pricing analysis principles.\nSolid data analysis skills.\nSolid oral, written and presentation skills.\nAbility to physically perform general office requirements.\nMust be able to perform essential responsibilities with or without reasonable accommodations.",Industry Type: IT Services & Consulting,Department: Finance & Accounting,"Employment Type: Full Time, Permanent","['data analysis', 'pricing analysis', 'presentation skills', 'accounting', 'ca', 'financial analysis', 'us gaap', 'auditing', 'variance analysis', 'budgeting', 'ifrs', 'cpa', 'icwa', 'cma', 'financial reporting', 'financial planning', 'cost accounting', 'cost analysis', 'taxation', 'pricing', 'finance']",2025-06-12 00:47:22
Associate - Cross Reference EU,Avantor,0 - 5 years,Not Disclosed,['Coimbatore'],"The Opportunity\n\nAvantor is looking for a dynamic, forward-thinking, and experienced Associate - Cross Reference EU, who will be responsible for delivering results against some of the most complex business and technology initiatives.\n\nThis role will be a full-time position based out of IND- Coimbatore. If you are passionate about solving complex challenges and driving innovation - let s talk!\n\n\n\n\nWe are looking for an associate who can work on data management strategies by investigating and resolving data quality issues in enterprise applications via deletion and merging, while safeguarding against data loss.\n\n\n\n\n\nMAJOR JOB DUTIES & RESPONSABILITIES:\nAdhere to the workflow instructions/standard operating procedure provided by the business.\nExtract, analyze, update data, and implement of process improvement.\nLiaise with both internal and external customers and provide resolution with a customer centric approach.\nTo provide alternatives through Branding Strategy promoting sales of Private label products.\nTo enrich the SAP database by providing alternatives for Competitor codes.\nResponsible for the content of the cross-reference data in SAP.\nBuilding up knowledge of our product portfolio and know the preferred suppliers in different segments.\nWorks with large amounts of data and regularly audits, research, analyzes, makes modifications to, and communicates about all the above tasks.\nMaintains accurate tracking of open and closed requests to ensure smooth workflow and accurate reporting.\nPerform other duties as assigned.\n\n\n\nS, KNOWLEDGE & EXPERIENCE:\nResults oriented and works with a sense of urgency. Assertive, responsible for his/her own work and has a strong affinity for defining work in deliverables and is willing to commit to deadlines.\nFocused and versatile team player that is comfortable under pressure.\nKnowledge of distribution, project management skills, critical thinking, data analysis.\nExperienced level in MS Excel & knowledge of MS Access, SAP, SQL & basic VBA skills are a plus.\nExcellent communication skills, oral and written.\nResults driven, self-sufficient and highly motivate.\nMust be able to work effectively with all levels of the organization.\nMust be able to develop excel reports as well as PowerPoint presentations.\nKnowledge of Avantor systems.\nLogical thinking and ability to analyse, standardize and improve fragmented processes.\nIndependent thinker\nAffinity with large data sets and analytics\n\n\n\nEDUCATIONAL QUALIFICATIONS :\nEducationBachelor's /master s degree preferably in Biology, Chemistry / Life Science (Microbiology, Biotechnology, Biochemistry) or an equivalent subject.\nExperience0 to 5 years of experience in manufacturing and distribution environment preferred.\n\n\n\n\n\nDisclaimer:\nThe above statements are intended to describe the general nature and level of work being performed by employees assigned to this classification. They are not intended to be construed as an exhaustive list of all responsibilities, duties and skills required of employees assigned to this position. Avantor is proud to be an equal opportunity employer.\n\n\n\n\n\nWhy Avantor\n\n\n\nDare to go further in your career. Join our global team of 14,000+ associates whose passion for discovery and determination to overcome challenges relentlessly advances life-changing science.\n\n\nThe work we do changes people's lives for the better. It brings new patient treatments and therapies to market, giving a cancer survivor the chance to walk his daughter down the aisle. It enables medical devices that help a little boy hear his mom's voice for the first time. Outcomes such as these create unlimited opportunities for you to contribute your talents, learn new skills and grow your career at Avantor.\nWe are committed to helping you on this journey through our diverse, equitable and inclusive culture which includes learning experiences to support your career growth and success. At Avantor, dare to go further and see how the impact of your contributions set science in motion to create a better world.\n\nApply today!\n\n\n\n\n\nEEO Statement:\n\nWe are an Equal Employment/Affirmative Action employer and VEVRAA Federal Contractor. We do not discriminate in hiring on the basis of sex, gender identity, sexual orientation, race, color, religious creed, national origin, physical or mental disability, protected Veteran status, or any other characteristic protected by federal, state/province, or local law.\n\n\n\nIf you need a reasonable accommodation for any part of the employment process, please contact us by email at recruiting@avantorsciences.com and let us know the nature of your request and your contact information. Requests for accommodation will be considered on a case-by-case basis. Please note that only inquiries concerning a request for reasonable accommodation will be responded to from this email address.\n\n\n\n\n\n3rd party non-solicitation policy:",Industry Type: Biotechnology,Department: Data Science & Analytics,"Employment Type: Full Time, Permanent","['ms access', 'distribution', 'sql', 'vba', 'manufacturing', 'chemistry', 'project management', 'data analysis', 'data management', 'sap', 'management skills', 'process improvement', 'sales', 'data quality', 'marketing', 'product management', 'biochemistry', 'life sciences', 'product portfolio']",2025-06-12 00:47:25
Financial Analyst- Walkin Drive,eClerx,0 - 2 years,Not Disclosed,"['Thane', 'Navi Mumbai', 'Mumbai (All Areas)']","Shift Timings - Fixed EMEA & Night Shift | Management Level: Analyst | Location: Airoli (Navi Mumbai)/ Exp: 0-2 yrs / Immediate Joiners/ Comfortable with KYC and Non KYC process\nAll graduates and post-graduates needs to have all Sem Hardcopy Marksheets and Passing certificate.\nHR Reference (Mention on the CV): Samid Mirkar\nWe are seeking skilled individuals with a deep knowledge and understanding of Derivatives, Finance, Capital Market, KYC/AML, Accounts and Stock markets.",,,,"['Finance', 'NISM', 'fresher', 'Investment Banking', 'KYC', 'Derivatives']",2025-06-12 00:47:29
Reference Data Analyst,Trigent Software,2 - 4 years,2-7 Lacs P.A.,"['Hyderabad', 'Bengaluru']","Being a self-starter is essential\nStrong negotiation and relationship skills to bring Engineering and Business project sponsors and stakeholders to the table to build complex solutions while balancing competing priorities\nManage team of individuals involved in investigating and resolving product & pricing data exceptions and maintaining product data.\nProactively solve data quality issues from both tactical and strategic perspectives\nProactively work with market data and external vendors (e.g. Bloomberg, Reuters, S&P, etc..) to ensure we have the highest quality data in our systems\nThe product & pricing team covers data related to:\nEquities: Common Stock, Preferred Stock, Rights, Warrants, Exchange traded funds, ADRs, GDRs\nFixed income bonds: Corporate, Government, Agency, Emerging Market, Convertible, Structured notes\nListed derivatives: Options, Future Options, Option Baskets, Flex Options, Futures, Flex Futures\nOther products: Mutual Funds, Indices, Baskets, Fiduciary Notes, Credit Indices\nBASIC QUALIFICATIONS\nHighly motivated\nRisk based judgement reviews problems and can research appropriately across systems to determine next steps including appropriate escalation\nCommunication of ambiguous concepts – demonstrated ability to describe complex concepts across groups that do not always use the same jargon\nGeneral communication – essential for interacting at all levels, across business disciplines and regions\nWorkflow Prioritization – demonstrated ability to appropriately prioritize a diverse set of work tasks, takes ownership of completing tasks and works well under pressure to meet deadlines\nTechnical ability – demonstrates ability to grasp complex processes and workflows\nTeamwork – works well within a team of diverse individuals and high standard of execution and delivery towards common goals and objectives\nClient service – demonstrates effective management of internal stakeholders and/or external clients through effective relationship management and high standard of service",Industry Type: Analytics / KPO / Research,"Department: BFSI, Investments & Trading","Employment Type: Full Time, Permanent","['Mutual Funds', 'Bloomberg', 'Equities', 'Reference Data', 'Derivatives', 'Fixed income']",2025-06-12 00:47:32
Financial Analyst - Walk-in Drive,eClerx,0 - 2 years,"50,000-2.25 Lacs P.A.","['Thane', 'Navi Mumbai', 'Mumbai (All Areas)']",(Mention HR Harsh on CV )\nShift Timings - Fixed EMEA & Night Shift | Management Level: Analyst | Location: Airoli (Navi Mumbai)/ Exp: 0-2 yrs / Immediate Joiners/ Comfortable with KYC and Non KYC process\nAll graduates and post-graduates needs to have all Sem Hardcopy Marksheets and Passing certificate.\nIf experienced then candidate should have all the documents of previous organisation.\nHR Reference (Mention on the CV): Harsh Bhadra,,,,"['Finance', 'Cfa Level 1', 'Imarticus pursued', 'Investment Banking', 'Mutual Funds', 'Aml Kyc', 'CFA level2', 'Equity', 'Derivatives', 'Capital Market', 'NISM', 'fresher', 'KYC', 'Derivative Market']",2025-06-12 00:47:35
Financial Analyst,eClerx,0 - 2 years,Not Disclosed,"['Thane', 'Navi Mumbai', 'Mumbai (All Areas)']","Shift Timings - Fixed EMEA & Night Shift | Management Level: Analyst | Location: Airoli (Navi Mumbai)/ Exp: 0-2 yrs / Immediate Joiners/ Comfortable with KYC and Non KYC process\nAll graduates and post-graduates needs to have all Sem Hardcopy Marksheets and Passing certificate.\nHR Reference (Mention on the CV): Samid Mirkar\nWe are seeking skilled individuals with a deep knowledge and understanding of Derivatives, Finance, Capital Market, KYC/AML, Accounts and Stock markets.",,,,"['Finance', 'NISM', 'fresher', 'Investment Banking', 'KYC', 'Derivatives']",2025-06-12 00:47:37
Senior Data Analyst,Infiniti Research,3 - 6 years,20-25 Lacs P.A.,[],"Job Description:\nWe are looking for a talented and motivated Data Analyst / BI Developer with 3-6 years of experience to join our team. The ideal candidate will have a strong background in SQL, experience with dashboard creation using Tableau, and hands-on knowledge of AWS Redshift and Databricks. A problem-solver with excellent solution-finding abilities and a proactive, independent work ethic is essential.\n\nAs a key contributor to the team, you will work with various stakeholders to deliver actionable insights, and drive data-driven decision-making within the organization. A strong understanding of US healthcare is a plus.\n\nKey Responsibilities:\nDevelop, design, and maintain dashboards and reports using Tableau to support business decision-making.\nWrite and optimize complex SQL queries to extract, manipulate, and analyze data from multiple sources.\nCollaborate with cross-functional teams to understand business needs and translate them into effective data solutions.\nWork with AWS Redshift and Databricks for data extraction, transformation, and loading (ETL) processes.\nProactively identify and resolve data issues, acting as a solution finder to overcome challenges and drive improvements.\nWork independently, taking ownership of tasks and ensuring high-quality deliverables within deadlines.\nBe a strong team player, contributing to team knowledge sharing and fostering a collaborative environment.\nApply knowledge of US healthcare systems to help build relevant data solutions and insights.\nRequired Skills & Qualifications:\nMinimum 3 years of experience in data analysis, business intelligence, or related roles.\nStrong expertise in SQL for data querying and manipulation.\nExtensive experience creating dashboards and reports using Tableau.\nHands-on experience working with AWS Redshift and Databricks.\nProven problem-solving skills with a focus on providing actionable data solutions.\nSelf-motivated and able to work independently, while being a proactive team player.\nExperience or strong understanding of US healthcare systems and data-related needs.\nExcellent communication skills with the ability to work across different teams and stakeholders.\nDesired Skills (Nice to Have):\nFamiliarity with other BI tools or cloud platforms.\nExperience in healthcare data analysis or healthcare analytics.",Industry Type: Analytics / KPO / Research,Department: Data Science & Analytics,"Employment Type: Full Time, Permanent","['Redshift Aws', 'Tableau', 'Data Bricks', 'SQL', 'Healthcare Analytics', 'Pharma Analytics']",2025-06-12 00:47:41
Financial Analyst,eClerx,0 - 2 years,"50,000-2.25 Lacs P.A.","['Mumbai', 'Navi Mumbai', 'Mumbai (All Areas)']",(Mention HR Harsh on CV )\nShift Timings - Fixed EMEA & Night Shift | Management Level: Analyst | Location: Airoli (Navi Mumbai)/ Exp: 0-2 yrs / Immediate Joiners/ Comfortable with KYC and Non KYC process\nAll graduates and post-graduates needs to have all Sem Hardcopy Marksheets and Passing certificate.\nIf experienced then candidate should have all the documents of previous organisation.\nHR Reference (Mention on the CV): Harsh Bhadra,,,,"['Finance', 'Aml', 'Cfa Level 1', 'Imarticus learner', 'Aml Kyc', 'KYC', 'CPA', 'Derivatives', 'Freshers', 'CFA', 'OTC']",2025-06-12 00:47:44
"Data Scientist with EDA, Python, SQL and Business Analysis",Cognizant,8 - 11 years,Not Disclosed,['Hyderabad'],"Job Summary\nWe are seeking a highly skilled Data Scientist with Business analysis with good hands on in Python , SQL , EDA Data Visualization with 3 to 12+ years of experience\nKey Responsibilities:\nPerform exploratory data analysis (EDA) to uncover trends, patterns, and insights.\nDevelop and maintain dashboards and reports to visualize key business metrics.\nCollaborate with cross-functional teams to gather requirements and deliver data-driven solutions.",,,,"['python', 'eda', 'data analysis', 'data management', 'modeling', 'analytical', 'data manipulation', 'query', 'predictive analytics', 'microsoft azure', 'business analysis', 'cloud platforms', 'business analytics', 'machine learning', 'dashboards', 'sql', 'analytics', 'gcp', 'statistical modeling', 'data visualization', 'aws']",2025-06-12 00:47:46
Business Data Analyst,NetApp,8 - 12 years,Not Disclosed,['Bengaluru'],"Job Summary\nWe are seeking a highly skilled and experienced Senior Business Data Analyst to join our Entitlement and Install Base Master team. You will play a crucial role in driving the Install Base (IB) data strategy and vision. Your deep understanding of Install Base and Renewals business processes will be instrumental in ensuring accurate and efficient management of our Install Base Data.\nJob Requirements\nDrive the Install Base data strategy and vision, collaborating with cross-functional teams to define and implement data management processes and standards.\nDevelop a comprehensive understanding of the Install Base and Renewals business, including key metrics, processes, and customer lifecycles.\nDrive Enterprise projects ensuring alignment with organizational goals and objectives.\nCollaborate with stakeholders to gather requirements and translate business needs into technical solutions for Install Base data management.\nCollaborate with cross-functional teams to define and implement data governance policies and procedures.\nPerform in-depth data analysis and validation to identify trends, patterns, and insights that drive business decision-making.\nCollaborate with IT teams to enhance data systems and tools supporting Install Base data management, ensuring data quality and accessibility.\nProvide guidance and support to cross-functional teams on Install Base data-related matters, acting as a subject matter expert.\nIdentify opportunities for process improvements and automation to streamline Install Base data management and enhance operational efficiency.\nStay up-to-date with industry trends and best practices in Install Base and Renewals business processes and data management.\nCoach and mentor team members to foster their professional growth and ensure smooth operations, promoting a collaborative and high-performing environment.\n",,,,"['data analysis', 'data management', 'analytical', 'workflow', 'business requirements', 'install base', 'sql querying', 'renewals', 'relational databases', 'sql', 'data cleansing', 'data quality', 'business process', 'management', 'collaboration', 'business data analysis', 'data governance', 'communication skills']",2025-06-12 00:47:50
"Sr. Data Analyst – Tableau, SQL, Snowflake",Int9 Solutions,5 - 7 years,Not Disclosed,['Bengaluru'],"We are looking for a skilled Data Analyst with excellent communication skills and deep expertise in SQL, Tableau, and modern data warehousing technologies. This role involves designing data models, building insightful dashboards, ensuring data quality, and extracting meaningful insights from large datasets to support strategic business decisions.\n\nKey Responsibilities:\nWrite advanced SQL queries to retrieve and manipulate data from cloud data warehouses such as Snowflake, Redshift, or BigQuery.\nDesign and develop data models that support analytics and reporting needs.\nBuild dynamic, interactive dashboards and reports using tools like Tableau, Looker, or Domo.\nPerform advanced analytics techniques including cohort analysis, time series analysis, scenario analysis, and predictive analytics.\nValidate data accuracy and perform thorough data QA to ensure high-quality output.\nInvestigate and troubleshoot data issues; perform root cause analysis in collaboration with BI or data engineering teams.\nCommunicate analytical insights clearly and effectively to stakeholders.\n\nRequired Skills & Qualifications:\nExcellent communication skills are mandatory for this role.\n5+ years of experience in data analytics, BI analytics, or BI engineering roles.\nExpert-level skills in SQL, with experience writing complex queries and building views.\nProven experience using data visualization tools like Tableau, Looker, or Domo.\nStrong understanding of data modeling principles and best practices.\nHands-on experience working with cloud data warehouses such as Snowflake, Redshift, BigQuery, SQL Server, or Oracle.\nIntermediate-level proficiency with spreadsheet tools like Excel, Google Sheets, or Power BI, including functions, pivots, and lookups.\nBachelor's or advanced degree in a relevant field such as Data Science, Computer Science, Statistics, Mathematics, or Information Systems.\nAbility to collaborate with cross-functional teams, including BI engineers, to optimize reporting solutions.\nExperience in handling large-scale enterprise data environments.\nFamiliarity with data governance, data cataloging, and metadata management tools (a plus but not required).",Industry Type: IT Services & Consulting,Department: Data Science & Analytics,"Employment Type: Full Time, Permanent","['Snowflake', 'Tableau', 'Data Warehousing', 'Data Analytics', 'SQL', 'Scenario Analysis', 'Cohort Analysis', 'Data Modeling', 'Predictive Analysis', 'Redshift']",2025-06-12 00:47:52
MDM Data Analyst / Steward Lead,Gallagher Service Center (GSC),3 - 7 years,Not Disclosed,['Bengaluru'],"Role & responsibilities\n\nThe MDM Analyst / Data Steward works closely with business stakeholders to understand and gather data requirements, develop data models and database designs, and define and implement data standards, policies, and procedures. This role also implements any rules inside of the MDM tool to improve the data, performs deduplication projects to develop golden records, and overall works towards improving the quality of data in the domain assigned.\n\nRequired skills :\nTechnical Skills: Proficiency in MDM tools and technologies such as Informatica MDM, CluedIn, or similar platforms is essential. Familiarity with data modeling, data integration, and data quality control techniques is also important. Experience with data governance platforms like Collibra and Alation can be beneficial1.\nAnalytical Skills: Strong analytical and problem-solving skills are crucial for interpreting and working with large volumes of data. The ability to translate complex business requirements into practical MDM solutions is also necessary.\nData Management: Experience in designing, implementing, and maintaining master data management systems and solutions. This includes conducting data cleansing, data auditing, and data validation activities.\nCommunication and Collaboration: Excellent communication and interpersonal skills to effectively collaborate with business stakeholders, IT teams, and other departments.\nData Governance: In-depth knowledge of data governance, data quality, and data integration principles. The ability to develop and implement data management processes and policies is essential.\nEducational Background: A Bachelor's or Master's degree in Computer Science, Information Systems, Data Science, or a related field is typically required1.\nCertifications: Certification in the MDM domain (e.g., Certified MDM Professional) can be a plus\n\nKey Skills:\nBecome the expert at the assigned domain of data\nUnderstand all source systems feeding into the MDM\nWrite documentation of stewardship for the domain\nDevelop rules and standards for the domain of data\nGenerate measures of improvement to demonstrate to the business the quality of the data\n\nWe are seeking candidates who can join immediately or within a maximum of 30 days' notice.\nMinimum of 3+ years of relevant experience is required.\nCandidates who are willing to relocate to Bangalore or are already based in Bangalore.\nCandidates should be flexible with working UK/US shifts.",Industry Type: Analytics / KPO / Research,Department: Other,"Employment Type: Full Time, Permanent","['Informatica Mdm', 'Data Modeling', 'Data Integration']",2025-06-12 00:47:55
