key,job_role,job_title,company_name,skills,job_type,location,experience
1,Data Engineer,Data Engineer,Synechron Technologies Private Limited,Data Engineer,Full time,"Bengaluru / Bangalore, Pune",5-10 Years
2,Data Engineer,Data Engineer,Synechron Technologies Private Limited,Data Engineer,Full time,"Chennai, Mumbai",5-10 Years
3,Data Engineer,Data Engineer,Krishna Enterprises,"Sql,Data Mining,Data Extraction","Work From Home, Full time",Other India,7-12 Years
4,Data Engineer,Sr Data Engineer,Ethiraj Associates Private Limited,"Abinitio Graphs,Abinitio",Full time,"Bengaluru / Bangalore, Mumbai City",3-5 Years
5,Data Engineer,Sr Big Data Software Engineer,Mindpower HR Solutions,Spark,Full time,Bengaluru / Bangalore,8-13 Years
6,Data Engineer,Data Engineer,Evoluteiq Solutions Private Limited,"Data Processing,Java,Core Java,Hibernate",Full time,Bengaluru / Bangalore,5-10 Years
7,Data Engineer,Data Engineer,Mindpower HR Solutions,"Teradata,Scala,Java,Hadoop,Spark",Full time,Bengaluru / Bangalore,5-10 Years
8,Data Engineer,Data engineer,Yellow Umbrella Group,"Data-Engineer,Data-Engineering,Data Engineer",Full time,"Bengaluru / Bangalore, Chennai",3-6 Years
9,Data Engineer,Data Engineer,Coders Brain Technology Private Limited,"data stream,Data Engineer,AWS,Java",Full time,"Bengaluru / Bangalore, Hyderabad / Secunderabad, Telangana",5-10 Years
10,Data Engineer,Data Science Engineer,Innovatz Global LLC,"DL,Panda,Data Science,Ml,Nlp,Numpy","Contract Job, Part time","Bengaluru / Bangalore, Hyderabad / Secunderabad, Telangana",5-15 Years
11,Data Engineer,DATA ENGINEER,Icloudlogic India Private Limited,Data Engineer,Full time,"Hyderabad / Secunderabad, Telangana",4-5 Years
12,Data Engineer,AI Data Engineer,HNM Solutions,"Artificial Intelligence,Data Engineer,Sql,Python","Contract Job, Part time","Bengaluru / Bangalore, Chennai",5-10 Years
13,Data Engineer,Data Engineer,ID4 Consultancy Private Limited,"Glue,terabytes,AWS,Python,Sql,Emr",Full time,Pune,6-10 Years
14,Data Engineer,DATA ENGINEER,Supro Info Solutions Private Limited,"DATA BRICKS,Data Engineer,Sql,Etl,Python",Full time,Gurgaon / Gurugram,4-9 Years
15,Data Engineer,DATA ENGINEER,Supro Info Solutions Private Limited,"Data Engineer,Sql,Etl",Full time,"Hyderabad / Secunderabad, Telangana",4-9 Years
16,Data Engineer,(IND) Data Engineer III,Walmart Global Tech India,"Airflow,lambda Architecture,Streaming Data",Full time,"Bengaluru / Bangalore, India",3-5 Years
17,Data Engineer,Data Engineer,S&P Global Market Intelligence,"Maven Builds,JMS Queue,Dynamo,Glue",Full time,India,6-9 Years
18,Data Engineer,Snowflake Data Engineer/Lead,Brillio,"SnowSQL,Metadata Manager,star schemas",Full time,"Hyderabad / Secunderabad, Telangana, India",6-10 Years
19,Data Engineer,Data Engineer III,Walmart Global Tech India,"multi-hop architecture,Streaming Data,orchestration tools",Full time,"Bengaluru / Bangalore, India",2-4 Years
20,Data Engineer,Azure Data Analytics Engineer,CGI,"Azure certifications,Azure SQL Data Warehouse",Full time,"Bengaluru / Bangalore, India",4-5 Years
21,Data Engineer,AWS Data Engineer,Maverick Edutech Private Limited,"Spark,Redshift,S3",Full time,"Hyderabad / Secunderabad, Telangana",5-7 Years
22,Data Engineer,Automation - Data Engineer,Barclays,"Lake Formation,CloudTrail,Glue,Athena",Full time,Pune,0-2 Years
23,Data Engineer,Data Engineer III,Walmart Global Tech India,"Airflow,Streaming Data,Automic,Multi-hop Architecture",Full time,"Chennai, India",0-2 Years
24,Data Engineer,Data Engineer,IDFC FIRST Bank,"HDFS,Relational Databases,Hadoop,Yarn",Full time,"Thane, India",2-5 Years
25,Data Engineer,"Senior Engineer, Data Analytics Engineering",Western Digital,"CI/CD,Pyspark,Cloud Solutions,Ml,Jenkins",Full time,"Bengaluru / Bangalore, India",1-3 Years
26,Data Engineer,Data Engineer,TELUS International India,"sql/plsql,r,Data Warehouse,python,Machine Learning",Full time,"Noida, India",3-5 Years
27,Data Engineer,Data Engineer(WITT/Data Stratergy-Tester),BNP Paribas,"BA,SAP BOXI,DSR,Regression,Rca,Wealth Management",Full time,"Chennai, India",7-9 Years
28,Data Engineer,Senior Data Engineer,Oracle,"Mathematical,Statistical,communication",Full time,"Bengaluru / Bangalore, India",0-2 Years
29,Data Engineer,Data Engineer,IDFC FIRST Bank,"HDFS,Relational Databases,Hadoop,Yarn",Full time,"Thane, India",2-5 Years
30,Data Engineer,Senior Data Engineer,CGI,"Data pipeline ETL,Data modelling & design",Full time,"Bengaluru / Bangalore, India",0-2 Years
31,Data Engineer,Data & Software Engineer,Barclays,"Job Scheduling,Stakeholder Management",Full time,Pune,0-7 Years
32,Data Engineer,Data Production Engineer - HDP/CDP,BNP Paribas,"Ansible Tower,Anaconda,Cdp,Acls,Mattermost",Full time,"Chennai, India",3-5 Years
33,Data Engineer,Data Engineer,Deutsche Bank,"GitHub Actions,Vertex AI,Cloud Composer",Full time,"Pune, India",0-2 Years
34,Data Engineer,Azure Data Engineer,Birlasoft,"Azure HDInsight,Azure Synapse Analytics,Hadoop",Full time,"Noida, India",0-2 Years
35,Data Engineer,Snowflake Data Engineer/Lead,Brillio,"SnowSQL,Metadata Manager,star schemas",Full time,"Hyderabad / Secunderabad, Telangana, India",6-10 Years
36,Data Engineer,Data Engineer,Mastek,"snowflake,planning,CI/CD pipeline,ETL/ELT pipelines",Full time,"Chennai, India",2-5 Years
37,Data Engineer,Principal Consultant-Senior Data Engineer,Genpact,"Airflow,Step Functions,AWS,Sql,Databricks",Full time,"Hyderabad / Secunderabad, Telangana",0-2 Years
38,Data Engineer,Data Engineer,HCLTech,"Dwh,Sql,Etl,Sdlc",Full time,"Hyderabad / Secunderabad, Telangana, India",5-7 Years
39,Data Engineer,BIU:Data Engineer Cards Regulatory Reporting,Axis Bank,"triad,wtms,unix,Blaze,Cobol,Sql",Full time,"Chennai, India",3-8 Years
40,Data Engineer,BIU:Data Engineer-Personalization COE,Axis Bank,"triad,wtms,unix,Blaze,Cobol,Sql",Full time,"Bengaluru / Bangalore, India",3-8 Years
41,Data Engineer,"Associate, Senior GCP Data Engineer",Deutsche Bank,"ESG Risk,CSRD,Regulatory Reporting,Cloud SQL",Full time,"Bengaluru / Bangalore, India",5-7 Years
42,Data Engineer,Azure Data engineer,Birlasoft,"Azure Databricks,Etl,Data Modeling,Azure cloud services",Full time,"Bengaluru / Bangalore, India",0-2 Years
43,Data Engineer,AI + Data Engineer,Movate,"Azure Synapse Analytics,Azure SQL Database",Full time,"Chennai, India",7-8 Years
44,Data Engineer,"Associate, Senior GCP Data Engineer",Deutsche Bank,"ESG Risk,CSRD,Regulatory Reporting,Cloud SQL",Full time,"Bengaluru / Bangalore, India",5-7 Years
45,Data Engineer,"Associate, Senior GCP Data Engineer",Deutsche Bank,"Access Control,Python,Sql,Data Governance",Full time,"Bengaluru / Bangalore, India",5-7 Years
46,Data Engineer,Lead Consultant-Senior Data Engineer,Genpact,"Airflow,Step Functions,AWS,Sql,Databricks",Full time,"Hyderabad / Secunderabad, Telangana",0-2 Years
47,Data Engineer,Data Engineer-III-SUPPORT SERVICES-CTO Head,Kotak Mahindra Bank Limited,"Python,Sql,AWS,Java,Scala,Spark",Full time,"Bengaluru / Bangalore, India",2-5 Years
48,Data Engineer,Senior Data Engineer,Hyper Think Systems Private Limited,"azure datafactory,Synapse,Data Validation","Contract Job, International, Part time",Qatar,8-18 Years
49,Data Engineer,Azure Data Engineer,Birlasoft,"Azure Cosmos DB,Microsoft Certified,Apache Hadoop",Full time,"Pune, India",4-6 Years
50,Data Engineer,Data Engineer - GCP,Maneva Consulting Private Limited,"Big Query,Cloud Composer,data fusion",Full time,"Bengaluru / Bangalore, Hyderabad / Secunderabad, Telangana",6-12 Years
51,Data Engineer,AWS Data Engineer,Willware Technologies Private Limited,"Spark Airflow,AWS,Python,Sql","Work From Home, Full time",Chennai,5-9 Years
52,Data Engineer,Staff Engineer - Data Engineering,Altimetrik,"Salesforce Sales Cloud,Safe,Salesforce Data Cloud",Full time,"Chennai, India",2-6 Years
53,Data Engineer,Data Engineer With Python and Snowflake,Coders Brain Technology Private Limited,"snowflake,""AWS Cloud"",Python,Etl",Full time,"Bengaluru / Bangalore, Pune",6-10 Years
54,Data Engineer,AI Data Engineer,HNM Solutions,"AI Data engineer,data bricks,azure services",Full time,Chennai,5-6 Years
55,Data Engineer,AWS Data Engineer,Anisan Soft Tech Solutions Private Limited,"CI/CD,AWS",Full time,"Hyderabad / Secunderabad, Telangana",8-13 Years
56,Data Engineer,AI Data Engineer,HNM Solutions,"Azure Services,cloud,Sql,Python,Databricks",Full time,Chennai,6-13 Years
57,Data Engineer,Senior Data Engineer,White Horse Manpower Consultancy Private Limited,"Semarchy MDM,Informatica Mdm,Linux Shell Scripting",Full time,"Bengaluru / Bangalore, Hyderabad / Secunderabad, Telangana",6-10 Years
58,Data Engineer,Hiring Big Data Engineer,Epam Systems India Private Limited,"""Big data"",Spark,Scala,AWS,Sql",Full time,Other India,4-9 Years
59,Data Engineer,Big Data Engineer / Apache Spark,Maneva Consulting Private Limited,"Big Data Engineer,Junit,Sdlc,Git,Jira",Full time,"Bengaluru / Bangalore, Hyderabad / Secunderabad, Telangana",6-12 Years
60,Data Engineer,Data Engineer,Ness,"Industrialization of Algorithms,ML of pipeline",Full time,"Pune, India",Fresher
61,Data Engineer,Manager-Data Engineer,Genpact,"beautifulsoup,python,css,Javascript",Full time,Kolkata,0-2 Years
62,Data Engineer,Lead Consultant-Senior Azure Cloud Data Engineer,Genpact,"snowflake,SQLWarehouse,BLOB,Azure",Full time,Chennai,0-2 Years
63,Data Engineer,Azure data engineer,Narvi Placement School (OPC) Private Limited,"Synapse,Azure,SSIS,Ssrs,Sql",Full time,"Bengaluru / Bangalore, Chennai",4-8 Years
64,Data Engineer,Data Engineer- OBIEE,LTIMindtree Limited,"Business Intelligence,OBIEE,Data Warehouse",Full time,"Bengaluru / Bangalore, Mumbai",3-8 Years
65,Data Engineer,Data Engineer,Praxis Placement Consultancy,"snowflakes,data integrations,Data Engineer",Full time,"Bengaluru / Bangalore, Kolkata",5-7 Years
66,Data Engineer,Data Engineer (Spark/Streaming),Synechron Technologies Private Limited,"Data Engineer,Big Data,Spark,Streaming",Full time,"Bengaluru / Bangalore, Pune",5-10 Years
67,Data Engineer,Data Engineer - OACS,LTIMindtree Limited,"OACS,OAC,OAS,OBIEE",Full time,Mumbai,3-8 Years
68,Data Engineer,Data Engineer,Synechron Technologies Private Limited,"Data Engineer,Big Data,Hadoop,Hive",Full time,Mumbai,5-10 Years
69,Data Engineer,Data Engineer with AWS Glue Redshift,Prajosh Technologies Private Limited,AWS,"International, Full time",Malaysia,4-6 Years
70,Data Engineer,Principle Data Engineer,Synechron Technologies Private Limited,"Principle Data Engineer,Big Data,Hadoop",Full time,Mumbai,15-20 Years
71,Data Engineer,Data Engineer,Synechron Technologies Private Limited,"Data Engineer,Big Data,Hadoop,Hive",Full time,"Chennai, Hyderabad / Secunderabad, Telangana",5-10 Years
72,Data Engineer,Data Engineer,Career Foresight Hr Solutions Llp,Data Engineer,Full time,Cochin / Kochi / Ernakulam,6-10 Years
73,Data Engineer,Data Engineer (Spark/Streaming),Synechron Technologies Private Limited,"Data Engineer,Big Data,Spark,Streaming",Full time,Mumbai,5-10 Years
74,Data Engineer,"Sr. Data Engineer, Global Analytic (TCF)",Concentrix,"Data Analysis,Advance Excel,Pivot Tables",Full time,"Pune, India",4-6 Years
75,Data Engineer,Senior Software Engineer - Data Engineer,CGI,"airflow,communication,azure data analytics architecture",Full time,"Bengaluru / Bangalore, India",5-7 Years
76,Data Engineer,Consulting - BO - Cloud Engineering - Senior Consultant - Azure Data Engineer,Deloitte,"MS SQL RDBMS,SQL Query Language,data warehouse transformation processes",Full time,"Bengaluru / Bangalore, India",6-9 Years
77,Data Engineer,Senior BI Engineer - Data Analytics,Atlas Copco,"Ms Azure,Power Bi,Data Modelling,PowerShell",Full time,"Pune, India",3-6 Years
78,Data Engineer,Project Engineer - MMS Data Management,Hitachi Energy,"Electric Utilities,Power System,electricity markets",Full time,"Bengaluru / Bangalore, India",0-2 Years
79,Data Engineer,Data Engineer/Business System Analyst,BNP Paribas,"Attention To Detail,Analytical Ability,Data Analysis",Full time,"Chennai, India",5-7 Years
80,Data Engineer,"Principal Consultant, Data Engineer",Genpact,"ETL Developer,Azure SQL database,Okta",Full time,Bengaluru / Bangalore,0-2 Years
81,Data Engineer,Senior Project Engineer MMS Data Management,Hitachi Energy,,Full time,"Bengaluru / Bangalore, India",Fresher
82,Data Engineer,Consulting-BO-Cloud Engineering-GCP Data Engineer-Pune,Deloitte,"cloud composer,data catalogue,gcs,pub-sub",Full time,"Pune, India",4-6 Years
83,Data Engineer,Staff Software Data Engineer (Java & Python),NCR Corporation,"design skills,Troubleshooting,Pyspark,Spring Boot",Full time,"Hyderabad / Secunderabad, Telangana, India",2-10 Years
84,Data Engineer,"Senior Data Engineer, YouTube",Google,"data integrations,business intelligence,machine learning models",Full time,"Bengaluru / Bangalore, India",8-10 Years
85,Data Engineer,Data Production ENGINEER HDP/CDP,BNP Paribas,"Ansible Tower,Anaconda,Cdp,Acls,Mattermost",Full time,"Chennai, India",3-5 Years
86,Data Engineer,Data Engineer,CGI,"airflow,Teradata,ci/cd,oracle,Hive,Mongo",Full time,"Hyderabad / Secunderabad, Telangana, India",5-6 Years
87,Data Engineer,Technical Associate Data Engineer,Genpact,,Full time,"Hyderabad / Secunderabad, Telangana",Fresher
88,Data Engineer,Consulting - BO - Cloud Engineering - Consultant - Azure Data Engineer,Deloitte,,Full time,"Bengaluru / Bangalore, India",Fresher
89,Data Engineer,Lead Consultant- Google Cloud Platform (GCP) Data Engineer,Genpact,"ETL Processes,GCP Services,Dataprep,Python",Full time,"Hyderabad / Secunderabad, Telangana",0-2 Years
90,Data Engineer,Consulting-BO-Cloud Engineering-Senior Consultant-Data & Analytics,Deloitte,"Google Services,Looker Studio,Google Professional Data Engineer Cert",Full time,"Bengaluru / Bangalore, India",5-7 Years
91,Data Engineer,SnapLogic Data Engineer,Yellow Umbrella Group,"Snaplogic development,Troubleshooting",Full time,Remote,5-15 Years
92,Data Engineer,Internship - Data Engineer- Python+SQL,Nextogen Technologies Private Limited,"Python,Sql",Full time,"Hyderabad / Secunderabad, Telangana",Fresher
93,Data Engineer,Data Engineer,Synechron Technologies Private Limited,"Data Engineer,Spark,Hive,Sqoop,Kafka",Full time,"Bengaluru / Bangalore, Mumbai",7-10 Years
94,Data Engineer,Data Engineer,Synechron Technologies Private Limited,"Data Engineer,Spark,Hive,Sqoop,Kafka",Full time,Gurgaon / Gurugram,7-10 Years
95,Data Engineer,Data Engineer,Synechron Technologies Private Limited,"Data Engineer,Spark,Hive,Sqoop,Kafka",Full time,"Chennai, Pune",7-10 Years
96,Data Engineer,Sr. Azure Data Engineer,Tata Consultancy Services Limited,Azure Data Engineer,Full time,"Bengaluru / Bangalore, Kolkata",6-8 Years
97,Data Engineer,Data Engineer,Mobile Programming LLC,"Sql,AWS,Pyspark",Full time,Remote,6-8 Years
98,Data Engineer,Azure Data Engineer,Yellow Umbrella Group,"Azure Data Engineer,ADL,Data Engineer",Full time,"Bengaluru / Bangalore, Mumbai",7-10 Years
99,Data Engineer,Azure Data Engineer,Company name confidential,"Adf,Azure Data Bricks,Azure Data Lake,Pyspark",Full time,"Bengaluru / Bangalore, Hyderabad / Secunderabad, Telangana",5-13 Years
100,Data Engineer,GCP Data Engineer,LTIMindtree Limited,"""GCP"",Python,Sql,Cloud Computing",Full time,Mumbai,3-8 Years
101,Data Engineer,Consultant -Data Engineer,Genpact,"snowflake,Stream-sets pipelines,data ingestion",Full time,Pune,0-2 Years
102,Data Engineer,Consulting-BO-Cloud Engineering-Senior Consultant-GCP Big data Data Engineer-Chennai,Deloitte,"python,mysql,Apache Spark,sql server",Full time,"Delhi, India",5-8 Years
103,Data Engineer,Consulting-BO-Cloud Engineering-Senior Consultant-GCP Big data Data Engineer-Delhi,Deloitte,apache spart/cdh/hdp/emr/google dataproc/hd-insights distributed processing,Full time,"Delhi, India",4-8 Years
104,Data Engineer,Register Now!,Hinduja Global Solutions Limited,"AWS Athena,AWS Cloud formation,spark data frames",Full time,"Hyderabad / Secunderabad, Telangana, India",4-5 Years
105,Data Engineer,GCP Data Engineer,Synechron Technologies Private Limited,Gcp,Full time,"Hyderabad / Secunderabad, Telangana, Pune",10-17 Years
106,Data Engineer,Azure Data Engineer - Consultant - BLR (Job Code : J47638),Sampoorna Consultants Private Limited,Azure,Full time,Bengaluru / Bangalore,3-8 Years
107,Data Engineer,GCP Data Engineer,Synechron Technologies Private Limited,GCP Data Engineer,Full time,Pune,6-13 Years
108,Data Engineer,Azure / AWS Developer + AI + Data Engineer,Lyros Technologies Private Limited,"Azure Cognitive Services,Azure Machine Learning",Full time,Chennai,3-7 Years
109,Data Engineer,Azure Data Engineer,Aequor Information Technologies Priivate Limited,Azure data Engineer,Full time,Chennai,5-10 Years
110,Data Engineer,Data Engineer,Recwire Consultants Private Limited,"Apache Spark/Scala,Airflow,AWS,Big Data",Full time,Cochin / Kochi / Ernakulam,3-8 Years
111,Data Engineer,Azure Data Engineer in a reputed company .,Talentico Consultancy Services,"Mandatory skills- Azure Cloud expertise,Synapse/Pyspark Good to have- Java",Full time,"Bengaluru / Bangalore, Chennai",7-12 Years
112,Data Engineer,Data Science Engineer,Electrobrain Modern Technologies Private Limited,pythondata miningProblem SolvingsqlData Science Pysparkalgorithmsnatural language processingteam handlingtime seriesnosqlanalyticsdeep learningregressionlogistic regressionmongodb,Full time,"Noida, Pune",3-8 Years
113,Data Engineer,AI + Data Engineer,Lyros Technologies Private Limited,"troubleshoot data pipeline,monitoring data pipeline",Full time,Chennai,3-7 Years
114,Data Engineer,Sr. Data Engineer,foundit,"Azure,Data Engineer",Full time,Bengaluru / Bangalore,3-5 Years
115,Data Engineer,DATA ENGINEER Looking for 4 plus years Hyderabad Location Work From Office,Mindquest Software Solutions Private Limited,Data Engineer,Full time,"Hyderabad / Secunderabad, Telangana",4-6 Years
116,Data Engineer,Data Engineer,Dmaic Academy And Consultancy,"Databrick,Python,Pyspark",Full time,Coimbatore,6-12 Years
117,Data Engineer,Data Engineer with Python,HNM Solutions,"Data Engineer,python,AWS,Pyspark",Full time,Chennai,5-5 Years
118,Data Engineer,Urgent opening for the post of Big data engineer for Hyderabad location.,Addon Manpower Solutions Private Limited,big data engineer,Full time,"Hyderabad / Secunderabad, Telangana",5-8 Years
119,Data Engineer,Azure Data Engineer in a reputed company .,Talentico Consultancy Services,"Mandatory skills- Azure Cloud expertise,Synapse/Pyspark Good to have- Java",Full time,"Bengaluru / Bangalore, Chennai",7-12 Years
120,Data Engineer,Azure Data Engineer,Tredence Analytics Solutions Private Limited,Data Engineer,Full time,"Bengaluru / Bangalore, Gurgaon / Gurugram",5-9 Years
121,Data Engineer,Data Engineer,Leverage Business Solutions Private Limited,"Spark,Mysql,Oracle,Aws Cloud,Python",Full time,Bengaluru / Bangalore,2-4 Years
122,Data Engineer,Sr. Data Engineer,foundit,"Azure,Data Engineer",Full time,Bengaluru / Bangalore,3-5 Years
123,Data Engineer,GCP Data Engineer,Synechron Technologies Private Limited,Gcp,Full time,"Hyderabad / Secunderabad, Telangana, Pune",10-17 Years
124,Data Engineer,H1B Visa Sponsorship for IT Professionals for Azure/AWS Data Engineer,Intalent LLC,"Data Optimization,Data Analysis,Deployment","International, Full time","Hyderabad / Secunderabad, Telangana, United States of America (USA)",6-12 Years
125,Data Engineer,Azure Data Engineer,Elite,Azure Data Engineer,Full time,Coimbatore,5-10 Years
126,Data Engineer,Data Science Engineer,Electrobrain Modern Technologies Private Limited,pythondata miningProblem SolvingsqlData Science Pysparkalgorithmsnatural language processingteam handlingtime seriesnosqlanalyticsdeep learningregressionlogistic regressionmongodb,Full time,"Noida, Pune",3-8 Years
127,Data Engineer,Senior Data Engineer,White Horse Manpower Consultancy Private Limited,"Power informatica,Oracle,SQL Server,Sdlc Process",Full time,Bengaluru / Bangalore,8-12 Years
128,Data Engineer,Data Engineer,Tranquil Hr Solutions Private Limited,"Cloud Data Engineering,Spark,Databricks",Full time,Chennai,4-6 Years
129,Data Engineer,Azure Data Engineer - Consultant - BLR (Job Code : J47638),Sampoorna Consultants Private Limited,Azure,Full time,Bengaluru / Bangalore,3-8 Years
130,Data Engineer,Azure / AWS Developer + AI + Data Engineer,Lyros Technologies Private Limited,"Azure Cognitive Services,Azure Machine Learning",Full time,Chennai,3-7 Years
131,Data Engineer,Sr Azure Data Engineer,Company name confidential,"Data Processing,databrick,Data Structures","Jobs for Women, Full time",Pune,5-7 Years
132,Data Engineer,Sr. Data Engineer,foundit,"Azure,Data Engineer",Full time,Bengaluru / Bangalore,3-5 Years
133,Data Engineer,"AZURE , Data Engineer",Elite,"Azure,Data Engineer",Full time,Coimbatore,1-7 Years
134,Data Engineer,Data Engineer And DataWare House,Quess IT Staffing (Formerly known as Magna Infotech),"Dataware House,Python,Pyspark,Sql Queries",Full time,"Hyderabad / Secunderabad, Telangana",5-10 Years
135,Data Engineer,Urgent opening for the post of Big data engineer for Hyderabad location.,Addon Manpower Solutions Private Limited,big data engineer,Full time,"Hyderabad / Secunderabad, Telangana",5-8 Years
136,Data Engineer,Azure / AWS Developer + AI + Data Engineer,Lyros Technologies Private Limited,"Azure Cognitive Services,Azure Machine Learning",Full time,Chennai,3-7 Years
137,Data Engineer,Data Integration Engineer,Electrobrain Modern Technologies Private Limited,"Relationship Building,Manager Technology",Full time,"Noida, Pune",4-8 Years
138,Data Engineer,Urgent Requirement for Big Data Engineer Hadoop Scala,Talentico Consultancy Services,"Hadoop,Hadoop Big Data,Scala",Full time,Pune,5-10 Years
139,Data Engineer,Senior Data Engineer,White Horse Manpower Consultancy Private Limited,"Semarchy MDM,Linux Shell Scripting,Oracle Database",Full time,"Bengaluru / Bangalore, Hyderabad / Secunderabad, Telangana",6-9 Years
140,Data Engineer,Azure Data Engineer,Elite,"Azure,Data Engineer",Full time,"Bengaluru / Bangalore, Coimbatore",5-10 Years
141,Data Engineer,Data Engineer - AWS,Capgemini Technology Services India Limited,"Glue,AWS,Redshift,Python,Pyspark",Full time,"Bengaluru / Bangalore, Pune",5-10 Years
142,Data Engineer,Azure Data Engineer - Consultant - BLR (Job Code : J47638),Sampoorna Consultants Private Limited,Azure,Full time,Bengaluru / Bangalore,3-8 Years
143,Data Engineer,H1B Visa Sponsorship for IT Professionals for Azure/AWS Data Engineer,Intalent LLC,"Data Optimization,Data Analysis,Deployment","International, Full time","Hyderabad / Secunderabad, Telangana, United States of America (USA)",6-12 Years
144,Data Engineer,Data Science Engineer,Electrobrain Modern Technologies Private Limited,"Microservices,Web Technologies,Data Science",Full time,"Noida, Pune",3-8 Years
145,Data Engineer,AWS Data engineer,Kaizen SRA Technologies Private Limited,"airflow,python,Pyspark,aws,oozie","Jobs for Women, Full time",Bengaluru / Bangalore,4-8 Years
146,Data Engineer,Data Engineer,Leverage Business Solutions Private Limited,"Spark,Mysql,Oracle,Aws Cloud,Python",Full time,Bengaluru / Bangalore,2-4 Years
147,Data Engineer,Sr. Data Warehouse Engineer,Western Digital,"Odi,PL/SQL,Data Warehouse",Full time,"Bengaluru / Bangalore, India",7-10 Years
148,Data Engineer,DATA ENGINEER III,Walmart Global Tech India,"R,Plotly,Looker,Matplotlib,Powerbi,Seaborn",Full time,"Bengaluru / Bangalore, India",3-4 Years
149,Data Engineer,Data Assurance Engineer III,Walmart Global Tech India,,Full time,"Bengaluru / Bangalore, India",Fresher
150,Data Engineer,Data Assurance Engineer III,Walmart,"standard operating procedures,Insider threat investigations",Full time,"Chennai, India",5-8 Years
151,Data Engineer,PySpark Developer,HNM Solutions,"Data Engineer,Pyspark,Nosql",Full time,Chennai,8-13 Years
152,Data Engineer,Expert Data Engineer,Schneider Electric,"Azure Pipelines,Github actions,R,CI/CD",Full time,"Bengaluru / Bangalore, India",6-8 Years
153,Data Engineer,Senior Engineer - Data Engineering,Altimetrik,"Problem Solving,Collaboration,IT,Attention To Detail",Full time,"Bengaluru / Bangalore, India",5-7 Years
154,Data Engineer,Big Data Production Support Engineer,Societe Generale,"Airflow,Control-M,Unix,Hadoop,Big Data",Full time,"Bengaluru / Bangalore, India",0-2 Years
155,Data Engineer,Big Data Engineer - Lead,HARMAN International,"database schema design,reusable code/component",Full time,"Bengaluru / Bangalore, India",5-7 Years
156,Data Engineer,"Staff Engineer, Data Analytics Engineering",Western Digital,"Splunk/Grafana,Data Frames,relational database systems",Full time,"Bengaluru / Bangalore, India",6-8 Years
157,Data Engineer,"Senior Engineer, Data Analytics Engineering",Western Digital,"CI/CD,Pyspark,Cloud Solutions,Jenkins",Full time,"Bengaluru / Bangalore, India",1-3 Years
158,Data Engineer,Data Engineer,CGI,"Data Analysis,data engineering,Data Architecture",Full time,"Pune, India",5-7 Years
159,Data Engineer,Data Engineer,Careernet,"snowflake,python,cloud,Data Warehousing",Full time,"Bengaluru / Bangalore, India",5-7 Years
160,Data Engineer,Big Data Engineer,CGI,"Nosql,Hadoop,Scala,Apache Spark,Apache Storm",Full time,"Bengaluru / Bangalore, India",0-2 Years
161,Data Engineer,Data engineer,Ericsson,"Analytics,Process Query Language,Celonis",Full time,"Bengaluru / Bangalore, India",3-5 Years
162,Data Engineer,Data Engineer III,Walmart,"Airflow,structured streaming,Data Processing",Full time,"Bengaluru / Bangalore, India",0-2 Years
163,Data Engineer,Data Engineer II/III - Oracle Plsql,FedEx Logistics,"oracle supplied packages,Oracle Collection",Full time,"Hyderabad / Secunderabad, Telangana, India",10-12 Years
164,Data Engineer,Staff Engineer - Data Analytics Engineering,Western Digital,"Airflow,columnar database environment",Full time,"Bengaluru / Bangalore, India",6-8 Years
165,Data Engineer,Big Data Engineer,CGI,"Nosql,Hadoop,Scala,Apache Spark,Apache Storm",Full time,"Bengaluru / Bangalore, India",0-2 Years
